FALSE,30065,2001,Small D M,Brain,1,Chocolate 1-7: rCBF Decreases with Decreasing Reward Value,"Emotion.Other,Perception.Gustation",18
FALSE,30065,2001,Small D M,Brain,2,Water Pre-Chocolate minus Post-Chocolate: Decreases rCBF with Decreasing Reward Value,"Emotion.Other,Perception.Gustation",18
TRUE,30065,2001,Small D M,Brain,3,Chocolate 1-7: rCBF Increases with Decreasing Reward Value,"Emotion.Other,Perception.Gustation",11
TRUE,30065,2001,Small D M,Brain,4,Water Pre-Chocolate - Water Post-Chocolate: rCBF Increases with Decreasing Reward Value,"Emotion.Other,Perception.Gustation",10
TRUE,30185,1998,Wagner A D,Neuroreport,1,Encoding Words > Textures,"Cognition.Memory.Explicit,Cognition.Language.Orthography",11
FALSE,30185,1998,Wagner A D,Neuroreport,2,Encoding Textures > Words,"Perception.Vision.Shape,Cognition.Memory.Explicit",4
FALSE,30185,1998,Wagner A D,Neuroreport,3,Retrieval Words > Textures,"Cognition.Memory.Explicit,Cognition.Language.Orthography",13
FALSE,30185,1998,Wagner A D,Neuroreport,4,Retrieval Textures > Words,"Cognition.Memory.Explicit,Perception.Vision.Shape",4
TRUE,30197,2001,Muley S A,NeuroImage,1,"Baseline - Activation Effects in SF2, Canonical Variates Analysis, Increases",Action.Execution,6
FALSE,30197,2001,Muley S A,NeuroImage,2,"Baseline - Activation Effects in SF2, Canonical Variates Analysis, Decreases",Action.Execution,1
FALSE,30197,2001,Muley S A,NeuroImage,3,"Baseline - Activation Effects in SF3, Canonical Variates Analysis, Increases",Action.Execution,8
FALSE,30197,2001,Muley S A,NeuroImage,4,"Baseline - Activation Effects in SF3, Canonical Variates Analysis, Decreases",Action.Execution,2
FALSE,30197,2001,Muley S A,NeuroImage,5,"Reproducible Activations for a Linear Force Effect, GLM Analyses, Increases",Action.Execution,8
FALSE,30197,2001,Muley S A,NeuroImage,6,"Reproducible Activations for a Linear Force Effect, GLM Analyses, Decreases",Action.Execution,4
FALSE,30242,1997,Braun A R,Brain,1,"Orolaryngeal Motor - Rest, Controls",Action.Execution.Speech,10
FALSE,30242,1997,Braun A R,Brain,2,"Orolaryngeal Motor - Rest, Stuttering Subjects",Action.Execution.Speech,12
TRUE,30242,1997,Braun A R,Brain,3,"Dysfluent Language Contrasts, Controls","Cognition.Language.Speech,Action.Execution.Speech",14
FALSE,30242,1997,Braun A R,Brain,4,"Dysfluent Language Contrasts, Stuttering Subjects","Cognition.Language.Speech,Action.Execution.Speech",22
TRUE,30242,1997,Braun A R,Brain,5,"Fluent Language Contrasts, Controls","Cognition.Language.Speech,Action.Execution.Speech",7
FALSE,30242,1997,Braun A R,Brain,6,"Fluent Language Contrasts, Stuttering Subjects","Cognition.Language.Speech,Action.Execution.Speech",10
FALSE,30242,1997,Braun A R,Brain,7,"Relative Increases, Dysfluent Conditions, Stuttering Subjects","Cognition.Language.Speech,Action.Execution.Speech",12
FALSE,30242,1997,Braun A R,Brain,8,"Relative Decreases, Dysfluent Conditions, Stuttering Subjects","Cognition.Language.Speech,Action.Execution.Speech",9
FALSE,30242,1997,Braun A R,Brain,9,"Relative Increases, Dysfluent Conditions, Controls","Cognition.Language.Speech,Action.Execution.Speech",5
FALSE,30242,1997,Braun A R,Brain,10,"Relative Decreases, Dysfluent Conditions, Controls","Cognition.Language.Speech,Action.Execution.Speech",8
FALSE,30242,1997,Braun A R,Brain,11,Positive Correlations: Dysfluency in Stuttering Subjects,"Cognition.Language.Speech,Action.Execution.Speech",9
FALSE,30242,1997,Braun A R,Brain,12,Negative Correlations: Dysfluency in Stuttering Subjects,"Cognition.Language.Speech,Action.Execution.Speech",18
FALSE,30312,2003,Gaillard W D,Human Brain Mapping,1,"Fixed Effect, Semantic Verbal Fluency, Children","Cognition.Language.Semantics,Cognition.Language.Speech",13
TRUE,30312,2003,Gaillard W D,Human Brain Mapping,2,"Fixed Effect, Semantic Verbal Fluency, Adults","Cognition.Language.Semantics,Cognition.Language.Speech",14
TRUE,30375,1998,Carlson S,Cerebral Cortex,1,Two-Back vs. Zero-Back,Cognition.Memory.Working,28
FALSE,30375,1998,Carlson S,Cerebral Cortex,2,One-Back vs. Zero-Back,Cognition.Memory.Working,17
TRUE,30375,1998,Carlson S,Cerebral Cortex,3,Two-Back vs. One-Back,Cognition.Memory.Working,26
FALSE,30387,2003,Gruber O,NeuroImage,1,"Verbal Working Memory, Absence of Articulatory Suppression, Verbal Rehearsal",Cognition.Memory.Working,1
FALSE,30387,2003,Gruber O,NeuroImage,2,"Verbal Working Memory, Absence of Articulatory Suppression, Effects of Articulatory Suppression",Cognition.Memory.Working,1
FALSE,30387,2003,Gruber O,NeuroImage,3,"Verbal Working Memory, Absence of Articulatory Suppression, Silent Articulations",Cognition.Memory.Working,1
FALSE,30387,2003,Gruber O,NeuroImage,4,"Verbal Working Memory, Absence of Articulatory Suppression, Phonological Storage",Cognition.Memory.Working,9
FALSE,30387,2003,Gruber O,NeuroImage,5,"Verbal Working Memory, Under Articulatory Suppression, Effects of Articulatory Suppression",Cognition.Memory.Working,8
FALSE,30387,2003,Gruber O,NeuroImage,6,"Verbal Working Memory, Independent of or Enhanced by Articulatory Suppression, Verbal Rehearsal",Cognition.Memory.Working,14
FALSE,30387,2003,Gruber O,NeuroImage,7,"Verbal Working Memory, Independent of or Enhanced by Articulatory Suppression, Phonological Storage",Cognition.Memory.Working,13
FALSE,30387,2003,Gruber O,NeuroImage,8,"Verbal Working Memory, Independent of or Enhanced by Articulatory Suppression, Art. Suppression",Cognition.Memory.Working,3
FALSE,30387,2003,Gruber O,NeuroImage,9,"Verbal Working Memory, Independent of or Enhanced by Articulatory Suppression, Silent Articulations",Cognition.Memory.Working,1
FALSE,30387,2003,Gruber O,NeuroImage,10,"Visuospatial Working Memory, Visuospatial Rehearsal",Cognition.Memory.Working,11
FALSE,30387,2003,Gruber O,NeuroImage,11,"Visuospatial Working Memory, Visual Pattern Storage",Cognition.Memory.Working,11
FALSE,30387,2003,Gruber O,NeuroImage,12,"Visuospatial Working Memory, Effects of Visuospatial Suppression on Memory-Related Activations",Cognition.Memory.Working,11
TRUE,30387,2003,Gruber O,NeuroImage,13,"Visuospatial Working Memory, Eye Tracking",Cognition.Memory.Working,11
FALSE,30387,2003,Gruber O,NeuroImage,14,"Visuospatial Working Memory, Absence of Visuospatial Suppression, Visuospatial Rehearsal",Cognition.Memory.Working,4
FALSE,30387,2003,Gruber O,NeuroImage,15,"Visuospatial Working Memory, Absence of Visuospatial Suppression, Effects of Visuospatial Suppr.",Cognition.Memory.Working,4
FALSE,30387,2003,Gruber O,NeuroImage,16,"Visuospatial Working Memory, Absence of Visuospatial Suppression, Eye Tracking",Cognition.Memory.Working,4
FALSE,30387,2003,Gruber O,NeuroImage,17,"Visuospatial Working Memory, Independent of Visuospatial Suppression, Visuospatial Rehearsal",Cognition.Memory.Working,5
FALSE,30387,2003,Gruber O,NeuroImage,18,"Visuospatial Working Memory, Independent of Visuospatial Suppression, Visual Pattern Storage",Cognition.Memory.Working,5
FALSE,30448,2000,Nystrom L E,NeuroImage,1,Shapes > Letters,Cognition.Memory.Working,4
FALSE,30448,2000,Nystrom L E,NeuroImage,2,Letters > Shapes,Cognition.Memory.Working,2
FALSE,30448,2000,Nystrom L E,NeuroImage,3,Letters and Shapes Interactions,Cognition.Memory.Working,2
TRUE,30448,2000,Nystrom L E,NeuroImage,4,Locations > Letters,Cognition.Memory.Working,5
FALSE,30448,2000,Nystrom L E,NeuroImage,5,Locations and Letters Interactions,Cognition.Memory.Working,3
FALSE,30448,2000,Nystrom L E,NeuroImage,6,Locations > Shapes,Cognition.Memory.Working,2
FALSE,30448,2000,Nystrom L E,NeuroImage,7,Shapes > Locations,Cognition.Memory.Working,1
FALSE,30448,2000,Nystrom L E,NeuroImage,8,Shapes and Locations Interactions,Cognition.Memory.Working,4
FALSE,5070066,2002,Boecker H,NeuroImage,1,Sequences I to V Combined > Rest,Action.Imagination,11
FALSE,5070066,2002,Boecker H,NeuroImage,2,Sequences I to V Combined < Rest,Action.Imagination,5
TRUE,5070066,2002,Boecker H,NeuroImage,3,Positive correlation with sequence complexity,Action.Imagination,5
FALSE,5070066,2002,Boecker H,NeuroImage,4,Inverse correlation with sequence complexity,Action.Imagination,5
FALSE,5070090,1999,LaBar K S,NeuroImage,1,Working Memory and Spatial Attention,"Cognition.Memory.Working,Cognition.Attention",26
TRUE,5070090,1999,LaBar K S,NeuroImage,2,Working Memory,Cognition.Memory.Working,8
FALSE,5070090,1999,LaBar K S,NeuroImage,3,Spatial Attention,Cognition.Attention,8
FALSE,5070092,2005,Meister I,Human Brain Mapping,1,"Non-Musicians, Simple - Baseline","Cognition.Music,Action.Execution",15
FALSE,5070092,2005,Meister I,Human Brain Mapping,2,"Non-Musicians, Complex - Baseline","Cognition.Music,Action.Execution",14
TRUE,5070092,2005,Meister I,Human Brain Mapping,3,"Non-Musicians, Complex - Simple","Cognition.Music,Action.Execution",3
FALSE,5070092,2005,Meister I,Human Brain Mapping,4,"Musicians, Simple - Baseline","Cognition.Music,Action.Execution",15
FALSE,5070092,2005,Meister I,Human Brain Mapping,5,"Musicians, Complex - Baseline","Cognition.Music,Action.Execution",13
FALSE,5070092,2005,Meister I,Human Brain Mapping,6,"Non-Musicians vs. Musicians, Simple",Cognition.Music,2
FALSE,5070092,2005,Meister I,Human Brain Mapping,7,"Non-Musicians vs. Musicians, Complex",Cognition.Music,2
TRUE,5070126,2003,Binder J R,Journal of Cognitive Neuroscience,1,Word > Nonword,Cognition.Language.Semantics,26
FALSE,5070126,2003,Binder J R,Journal of Cognitive Neuroscience,2,Nonword > Word,Cognition.Language.Semantics,9
FALSE,5070126,2003,Binder J R,Journal of Cognitive Neuroscience,3,Lo > Hi,Cognition.Language.Orthography,26
TRUE,5070126,2003,Binder J R,Journal of Cognitive Neuroscience,4,LoWord > HiWord,Cognition.Language.Orthography,14
FALSE,5070126,2003,Binder J R,Journal of Cognitive Neuroscience,5,LoNon > HiNon,Cognition.Language.Orthography,7
FALSE,5070139,2004,Hester R L,Journal of Cognitive Neuroscience,1,Cued and Uncued Successful Response Inhibition,"Action.Inhibition,Cognition.Attention",21
TRUE,5070139,2004,Hester R L,Journal of Cognitive Neuroscience,2,"Cued vs. Uncued, Increases","Action.Inhibition,Cognition.Attention",10
FALSE,5070139,2004,Hester R L,Journal of Cognitive Neuroscience,3,"Cued vs. Uncued, Decreases","Action.Inhibition,Cognition.Attention",6
FALSE,5080191,1992,Sergent J,Cerebral Cortex,1,Objects,Cognition.Language.Semantics,7
FALSE,5080191,1992,Sergent J,Cerebral Cortex,2,Letter-Spatial,"Perception.Vision.Shape,Cognition.Space",7
FALSE,5080191,1992,Sergent J,Cerebral Cortex,3,Letter-Sound,Cognition.Language.Phonology,5
FALSE,5080191,1992,Sergent J,Cerebral Cortex,4,Objects Minus Letter-Spatial,Cognition.Language.Semantics,6
FALSE,5080191,1992,Sergent J,Cerebral Cortex,5,Objects Minus Letter-Sound,Cognition.Language.Semantics,6
FALSE,5080191,1992,Sergent J,Cerebral Cortex,6,Letter-Spatial Minus Objects,"Perception.Vision.Shape,Cognition.Space",5
FALSE,5080191,1992,Sergent J,Cerebral Cortex,7,Letter-Spatial Minus Letter-Sound,"Perception.Vision.Shape,Cognition.Space",2
FALSE,5080191,1992,Sergent J,Cerebral Cortex,8,Letter-Sound Minus Letter-Spatial,Cognition.Language.Phonology,6
TRUE,5080191,1992,Sergent J,Cerebral Cortex,9,Letter-Sound Minus Objects,Cognition.Language.Phonology,7
TRUE,5090239,2000,Perry R J,Brain,1,Target vs. Null,"Perception.Vision.Motion,Action.Execution",17
FALSE,5090239,2000,Perry R J,Brain,2,Non-Target vs. Null,"Perception.Vision.Motion,Action.Execution",20
FALSE,5090239,2000,Perry R J,Brain,3,R Non-Target vs. Null,"Perception.Vision.Motion,Action.Execution",18
FALSE,5090239,2000,Perry R J,Brain,4,L Non-Target vs. Null,"Perception.Vision.Motion,Action.Execution",19
FALSE,5090239,2000,Perry R J,Brain,5,Non-Target vs. Target,"Perception.Vision.Motion,Action.Execution",8
FALSE,6050055,2004,Ino T,Brain Research Bulletin,1,"Encoding, Good Performance Group",Cognition.Memory.Explicit,15
TRUE,6050055,2004,Ino T,Brain Research Bulletin,2,"Encoding, Poor Performance Group",Cognition.Memory.Explicit,14
FALSE,6050055,2004,Ino T,Brain Research Bulletin,3,"Recall, Good Performance Group",Cognition.Memory.Explicit,18
FALSE,6050055,2004,Ino T,Brain Research Bulletin,4,Recall Poor Performance Group,Cognition.Memory.Explicit,12
FALSE,6050055,2004,Ino T,Brain Research Bulletin,5,"Encoding and Recall, Good Performance Group",Cognition.Memory.Explicit,19
FALSE,6050055,2004,Ino T,Brain Research Bulletin,6,"Encoding and Recall, Poor Performance Group",Cognition.Memory.Explicit,21
FALSE,6050055,2004,Ino T,Brain Research Bulletin,7,"Encoding, Good Performance > Poor Performance",Cognition.Memory.Explicit,5
FALSE,6050055,2004,Ino T,Brain Research Bulletin,8,"Recall, Good Performance > Poor Performance",Cognition.Memory.Explicit,5
FALSE,6050055,2004,Ino T,Brain Research Bulletin,9,"Encoding and Recall, Good Performance > Poor Performance",Cognition.Memory.Explicit,9
FALSE,6050055,2004,Ino T,Brain Research Bulletin,10,"Encoding, Poor Performance > Good Performance",Cognition.Memory.Explicit,9
FALSE,6050055,2004,Ino T,Brain Research Bulletin,11,"Recall, Poor Performance > Good Performance",Cognition.Memory.Explicit,4
FALSE,6050055,2004,Ino T,Brain Research Bulletin,12,"Encoding and Recall, Poor Performance > Good Performance",Cognition.Memory.Explicit,8
FALSE,6050055,2004,Ino T,Brain Research Bulletin,13,"Regression Analysis, Positive Effect on Memory Performance, Encoding",Cognition.Memory.Explicit,7
FALSE,6050055,2004,Ino T,Brain Research Bulletin,14,"Regression Analysis, Positive Effect on Memory Performance, Recall",Cognition.Memory.Explicit,6
FALSE,6050055,2004,Ino T,Brain Research Bulletin,15,"Regression Analysis, Positive Effect on Memory Performance, Encoding and Recall",Cognition.Memory.Explicit,13
FALSE,6050055,2004,Ino T,Brain Research Bulletin,16,"Regression Analysis, Negative Effect on Memory Performance, Encoding",Cognition.Memory.Explicit,12
FALSE,6050055,2004,Ino T,Brain Research Bulletin,17,"Regression Analysis, Negative Effect on Memory Performance, Recall",Cognition.Memory.Explicit,5
FALSE,6050055,2004,Ino T,Brain Research Bulletin,18,"Regression Analysis, Negative Effect on Memory Performance, Encoding and Recall",Cognition.Memory.Explicit,9
TRUE,6080131,2005,Audoin B,Human Brain Mapping,1,"PASAT - REPEAT, Controls",Cognition.Memory.Working,45
FALSE,6080131,2005,Audoin B,Human Brain Mapping,2,"MS Patients > Controls, PASAT - REPEAT",Cognition.Memory.Working,19
TRUE,6120184,2003,Beauchamp M H,NeuroImage,1,"Tower of London, EXP 1 vs. One-Move Control",Cognition.Reasoning,11
FALSE,6120184,2003,Beauchamp M H,NeuroImage,2,"Tower of London, EXPT 10 vs. One-Move Control",Cognition.Reasoning,1
FALSE,6120184,2003,Beauchamp M H,NeuroImage,3,Positive correlations between rCBF and total time in the four experimental conditions,Cognition.Reasoning,3
FALSE,6120184,2003,Beauchamp M H,NeuroImage,4,Negative correlations between rCBF and total time in the four experimental conditions,Cognition.Reasoning,1
FALSE,6120184,2003,Beauchamp M H,NeuroImage,5,"Positive correlations between rCBF and total time in the four EXPT, using the One-Move Control",Cognition.Reasoning,2
FALSE,6120184,2003,Beauchamp M H,NeuroImage,6,"Negative correlations between rCBF and total time in the four EXPT, using the One-Move Control",Cognition.Reasoning,1
FALSE,7020057,2005,Lange G,NeuroImage,1,"Study 1: mPASAT vs. Auditory Monitoring using a fixed effects model, CFS",Cognition.Memory.Working,15
FALSE,7020057,2005,Lange G,NeuroImage,2,"Study 1: mPASAT vs. Auditory Monitoring using a fixed effects model, Controls",Cognition.Memory.Working,5
FALSE,7020057,2005,Lange G,NeuroImage,3,"Study 2: mPASAT vs. Auditory Monitoring using a random effects model, CFS",Cognition.Memory.Working,25
TRUE,7020057,2005,Lange G,NeuroImage,4,"Study 2: mPASAT vs. Auditory Monitoring using a random effects model, Controls",Cognition.Memory.Working,6
FALSE,7020069,2007,Basho S,Neuropsychologia,1,Overall Effects for Category-Driven Word Generation,"Cognition.Language.Semantics,Cognition.Language.Speech,Action.Execution.Speech",6
TRUE,7020069,2007,Basho S,Neuropsychologia,2,Factor-Specific Effects for Paced,"Cognition.Language.Semantics,Cognition.Language.Speech,Action.Execution.Speech",7
FALSE,7020069,2007,Basho S,Neuropsychologia,3,Factor-Specific Effects for Unpaced,"Cognition.Language.Semantics,Cognition.Language.Speech,Action.Execution.Speech",1
FALSE,7020069,2007,Basho S,Neuropsychologia,4,Factor-Specific Effects for Overt,"Cognition.Language.Semantics,Cognition.Language.Speech,Action.Execution.Speech",2
FALSE,7020069,2007,Basho S,Neuropsychologia,5,Factor-Specific Effects for Covert,"Cognition.Language.Semantics,Cognition.Language.Speech",3
FALSE,7020069,2007,Basho S,Neuropsychologia,6,Paced > Unpaced,"Cognition.Language.Semantics,Cognition.Language.Speech,Action.Execution.Speech",11
FALSE,7020069,2007,Basho S,Neuropsychologia,7,Covert > Overt,"Cognition.Language.Semantics,Cognition.Language.Speech",8
TRUE,7070175,1995,Ghatan P H,NeuroImage,1,"Perceptual Maze vs. Rest, Increase in rCBF","Cognition.Reasoning,Action.Execution",23
FALSE,7070175,1995,Ghatan P H,NeuroImage,2,"Perceptual Maze vs. Rest, Decrease in rCBF","Cognition.Reasoning,Action.Execution",27
FALSE,7070175,1995,Ghatan P H,NeuroImage,3,"Motor Control vs. Rest, Increase in rCBF",Action.Execution,16
FALSE,7070175,1995,Ghatan P H,NeuroImage,4,"Motor Control vs. Rest, Decrease in rCBF",Action.Execution,8
FALSE,7070175,1995,Ghatan P H,NeuroImage,5,"Perceptual Maze vs. Motor Control, Increase in rCBF","Cognition.Reasoning,Action.Execution",17
FALSE,7070175,1995,Ghatan P H,NeuroImage,6,"Perceptual Maze vs. Motor Control, Decrease in rCBF","Cognition.Reasoning,Action.Execution",22
TRUE,7090256,2002,Ochsner K N,Journal of Cognitive Neuroscience,1,Reappraise > Attend,"Emotion.Other,Cognition.Other",12
FALSE,7090256,2002,Ochsner K N,Journal of Cognitive Neuroscience,2,Positive Correlation Between Activation and Drop in Negative Affect When Reappraising,"Emotion.Other,Cognition.Other",2
FALSE,7090256,2002,Ochsner K N,Journal of Cognitive Neuroscience,3,Attend > Reappraise,"Emotion.Other,Cognition.Other",5
FALSE,7100282,2006,Husain F T,Human Brain Mapping,1,"Category - Auditory, Tones",Perception.Audition,6
FALSE,7100282,2006,Husain F T,Human Brain Mapping,2,"Category - Auditory, Tonal Contours",Perception.Audition,5
FALSE,7100282,2006,Husain F T,Human Brain Mapping,3,"Category - Auditory, Vowels","Perception.Audition,Cognition.Language.Speech",12
FALSE,7100282,2006,Husain F T,Human Brain Mapping,4,"Category - Auditory, Syllables","Perception.Audition,Cognition.Language.Speech",8
FALSE,7100282,2006,Husain F T,Human Brain Mapping,5,"Category - Auditory, All (Pooled)","Perception.Audition,Cognition.Language.Speech",6
FALSE,7100282,2006,Husain F T,Human Brain Mapping,6,"Category - Auditory, Tones + Vowels","Perception.Audition,Cognition.Language.Speech",8
FALSE,7100282,2006,Husain F T,Human Brain Mapping,7,"Category - Auditory, Tonal Contours + Syllables","Perception.Audition,Cognition.Language.Speech",7
TRUE,7100282,2006,Husain F T,Human Brain Mapping,8,"Category - Auditory, Tones + Tonal Contours",Perception.Audition,10
FALSE,7100282,2006,Husain F T,Human Brain Mapping,9,"Category - Auditory, Vowels + Syllables","Perception.Audition,Cognition.Language.Speech",7
FALSE,7100288,2007,Fehr T,Brain Research,1,"Addition, Complex > Simple",Cognition.Other,17
TRUE,7100288,2007,Fehr T,Brain Research,2,"Subraction, Complex > Simple",Cognition.Other,18
FALSE,7100288,2007,Fehr T,Brain Research,3,"Multiplication, Complex > Simple",Cognition.Other,9
FALSE,7100288,2007,Fehr T,Brain Research,4,"Division, Complex > Simple",Cognition.Other,15
FALSE,7100288,2007,Fehr T,Brain Research,5,Conjunction (All Conditions),Cognition.Other,8
FALSE,7100291,2007,Woodard J L,Journal of Cognitive Neuroscience,1,Recent > Unfamiliar,Cognition.Memory.Explicit,12
TRUE,7100291,2007,Woodard J L,Journal of Cognitive Neuroscience,2,Remote > Unfamiliar,Cognition.Memory.Explicit,11
FALSE,7100291,2007,Woodard J L,Journal of Cognitive Neuroscience,3,Recent > Remote,Cognition.Memory.Explicit,1
FALSE,7110323,2007,Harrington G S,Human Brain Mapping,1,Write > Rest,Action.Imagination,13
FALSE,7110323,2007,Harrington G S,Human Brain Mapping,2,Draw > Rest,Action.Imagination,22
TRUE,7110323,2007,Harrington G S,Human Brain Mapping,3,Draw > Write,Action.Imagination,16
FALSE,7110331,2003,Ramnani N,Cerebral Cortex,1,Regions Activated in All Four Conditions,"Action.Preparation,Emotion.Other,Cognition.Other",15
FALSE,7110331,2003,Ramnani N,Cerebral Cortex,2,Main Effects of Motor Preparation,"Action.Preparation,Cognition.Other,Emotion.Other",10
TRUE,7110331,2003,Ramnani N,Cerebral Cortex,3,Main Effect of Reward Expectation,"Emotion.Other,Cognition.Other",21
FALSE,7110331,2003,Ramnani N,Cerebral Cortex,4,Interaction of Reward and Preparation Levels,"Emotion.Other,Action.Preparation,Cognition.Other",6
TRUE,7110344,2006,Denkova E,Neuropsychologia,1,Autobiographical vs. Semantic,Cognition.Memory.Explicit,15
FALSE,7110344,2006,Denkova E,Neuropsychologia,2,Autobiographical vs. Unknown,Cognition.Memory.Explicit,18
FALSE,7110344,2006,Denkova E,Neuropsychologia,3,Semantic vs. Unknown,Cognition.Memory.Explicit,10
FALSE,7110344,2006,Denkova E,Neuropsychologia,4,"(Autobiographical, Faces vs. Semantic, Faces) vs. (Autobiographical, Names vs. Semantic, Names)","Cognition.Memory.Explicit,Perception.Vision.Shape",1
FALSE,7110344,2006,Denkova E,Neuropsychologia,5,"(Autobiographical, Names vs. Semantic, Names) vs. (Autobiographical, Faces vs. Semantic, Faces)","Cognition.Memory.Explicit,Cognition.Language",1
FALSE,7110344,2006,Denkova E,Neuropsychologia,6,"(Semantic, Faces vs. Unknown, Male Faces) vs. (Semantic, Names vs. Unknown, Male Names)","Cognition.Memory.Explicit,Perception.Vision.Shape",1
FALSE,7110344,2006,Denkova E,Neuropsychologia,7,"(Semantic, Names vs. Unknown, Male Names) vs. (Semantic, Faces vs. Unknown, Male Faces)","Cognition.Memory.Explicit,Cognition.Language",1
TRUE,8040095,2006,Ongur D,Archives of General Psychiatry,1,"(IS>S) > (IP>P), Brain Activations During Transitive Inference Condition, Normals","Cognition.Memory.Explicit,Cognition.Reasoning",12
FALSE,8040095,2006,Ongur D,Archives of General Psychiatry,2,"(IS>S) > (IP>P), Brain Activations During Transitive Inference Condition, Schizophrenic Patients","Cognition.Memory.Explicit,Cognition.Reasoning",4
FALSE,8040095,2006,Ongur D,Archives of General Psychiatry,3,"(IS>S) > (IP>P), Brain Activations During Transitive Inference Condition, Normals vs. Patients","Cognition.Memory.Explicit,Cognition.Reasoning",2
FALSE,8040095,2006,Ongur D,Archives of General Psychiatry,4,"BD > NonBD, Brain Activations During Transitive Inference Condition, Normals","Cognition.Memory.Explicit,Cognition.Reasoning",2
FALSE,8040095,2006,Ongur D,Archives of General Psychiatry,5,"BD > NonBD, Brain Activations During Transitive Inference Condition, Schizophrenic Patients","Cognition.Memory.Explicit,Cognition.Reasoning",4
FALSE,8040095,2006,Ongur D,Archives of General Psychiatry,6,"BD > NonBD, Brain Activations During Transitive Inference Condition, Normals vs. Patients","Cognition.Memory.Explicit,Cognition.Reasoning",1
TRUE,8040105,2006,Kensinger E A,Journal of Neuroscience,1,Pictures Corresponding with Subsequent Item-and-Source Memory,"Cognition.Language.Semantics,Cognition.Memory.Explicit",9
FALSE,8040105,2006,Kensinger E A,Journal of Neuroscience,2,Words Corresponding with Subsequent Item-and-Source Memory,"Cognition.Language.Semantics,Cognition.Memory.Explicit",5
FALSE,8040105,2006,Kensinger E A,Journal of Neuroscience,3,All Items Corresponding with Subsequent Item-and-Source Memory,"Cognition.Language.Semantics,Cognition.Memory.Explicit",6
FALSE,8040105,2006,Kensinger E A,Journal of Neuroscience,4,Pictures Corresponding with Subsequent Item-Not-Source Memory,"Cognition.Language.Semantics,Cognition.Memory.Explicit",8
FALSE,8040105,2006,Kensinger E A,Journal of Neuroscience,5,Words Corresponding with Subsequent Item-Not-Source Memory,"Cognition.Language.Semantics,Cognition.Memory.Explicit",8
FALSE,8040105,2006,Kensinger E A,Journal of Neuroscience,6,All Items Corresponding with Item-Not-Source Memory,"Cognition.Language.Semantics,Cognition.Memory.Explicit",18
FALSE,8080230,2008,Munzert J,Experimental Brain Research,1,Motor Imagery > Gymnastic Film,Action.Imagination,5
FALSE,8080230,2008,Munzert J,Experimental Brain Research,2,Gymnastic Film > Motor Imagery,Action.Observation,4
TRUE,8080230,2008,Munzert J,Experimental Brain Research,3,Gymnastic Film and Motor Imagery > Fixation,"Action.Observation,Action.Imagination",12
TRUE,8110284,2004,Mainero C,NeuroImage,1,"PASAT, Normals",Cognition.Other,37
FALSE,8110284,2004,Mainero C,NeuroImage,2,"PASAT, Multiple Sclerosis Patients",Cognition.Other,39
FALSE,8110284,2004,Mainero C,NeuroImage,3,"Multiple Sclerosis Patients vs. Normals, PASAT",Cognition.Other,19
TRUE,8110284,2004,Mainero C,NeuroImage,4,"Recall, Normals",Cognition.Memory.Explicit,25
FALSE,8110284,2004,Mainero C,NeuroImage,5,"Recall, Multiple Sclerosis Patients",Cognition.Memory.Explicit,26
FALSE,8110284,2004,Mainero C,NeuroImage,6,"Multiple Sclerosis Patients vs. Normals, Recall",Cognition.Memory.Explicit,20
FALSE,9030052,2004,Chang K,Archives of General Psychiatry,1,"Visuospatial 2-back - Attention, Bipolar Patients > Normals","Cognition.Memory.Working,Cognition.Space",10
FALSE,9030052,2004,Chang K,Archives of General Psychiatry,2,"Visuospatial 2-back - Attention, Normals > Bipolar Patients","Cognition.Space,Cognition.Memory.Working",2
FALSE,9030052,2004,Chang K,Archives of General Psychiatry,3,"Visuospatial 2-back - Attention, Bipolar Patients","Cognition.Space,Cognition.Memory.Working",9
TRUE,9030052,2004,Chang K,Archives of General Psychiatry,4,"Visuospatial 2-back - Attention, Normals","Cognition.Space,Cognition.Memory.Working",6
